user_id,type,message,sent_at
1,email,Sistem akan maintenance pada malam hari ini,2025-08-16 18:00:00
2,telegram,QR Code untuk lokasi Kantor Pusat akan kedaluwarsa,2025-08-17 22:00:00
3,telegram,Anda terlambat masuk pada shift pagi hari ini,2025-08-18 07:15:00
4,email,Anda terlambat masuk pada shift siang hari ini,2025-08-19 15:30:00
5,telegram,Jangan lupa untuk melakukan presensi keluar,2025-08-20 14:30:00
6,telegram,Anda terlambat berat pada shift pagi hari ini,2025-08-21 07:45:00
7,email,Presensi Anda telah berhasil,2025-08-22 08:05:00
